{
  "schema_catalogo_modulos": 2,
  "versao_catalogo": "5.0.0",
  "serie_avaliacao": "modules-v2",
  "estado": "producao",
  "padrao_producao": true,
  "natureza": "contrato de avaliação pós-hoc; não é estado canônico nem altera o hot path",
  "contrato_cobertura_fail_closed": {
    "schema": 1,
    "modulos": [
      "context_and_memory",
      "turn_and_session_orchestration",
      "narrative_delivery",
      "rules_and_character_state",
      "sidequest_authoring",
      "sidequest_lifecycle",
      "canonical_quest_integration",
      "npc_continuity_and_social_behavior",
      "scene_world_projection",
      "world_boundary_resolution",
      "causal_narrative_routing",
      "adversarial_operations"
    ],
    "atividade_sem_recibo": "falha_instrumentacao",
    "recibo_incompleto": "falha_instrumentacao",
    "nao_aplicavel_exige_recibo_explicito": true,
    "nd_exige_zero_atividade_avaliativa": true,
    "pontuacao_exige_aplicabilidade_e_evidencia": true
  },
  "unidades_analise": [
    "turno",
    "cena",
    "fronteira",
    "sessao",
    "evento"
  ],
  "estados_ativacao": [
    "nao_elegivel",
    "elegivel_nao_ativado",
    "ativado_sem_efeito",
    "efeito_materializado",
    "falha_contratual",
    "indeterminado"
  ],
  "modulos": [
    {
      "id": "context_and_memory",
      "responsabilidade": "Fornecer somente o contexto necessário e preservar memória factual, autoria e separação das camadas de conhecimento.",
      "escopo": "Escada de acesso L0–L5, memória de cena e durável, retomada e consultas focadas; não decide a ficção.",
      "unidade_analise": "turno",
      "contrato_elegibilidade": {
        "gatilho": "O turno exige fundamentação factual, retomada ou persistência, ainda que o contexto já presente seja suficiente em L0.",
        "exclusoes": [
          "Leitura preventiva sem lacuna",
          "Busca ampla quando L0–L2 já bastam"
        ],
        "evidencias_minimas": [
          "contexto já presente em L0 ou lacuna/rota de acesso",
          "fontes efetivamente consultadas quando houver leitura"
        ]
      },
      "resultados_possiveis": [
        "contexto_suficiente",
        "aprofundamento_justificado",
        "lacuna_preservada",
        "acesso_excessivo",
        "indeterminado"
      ],
      "subcapacidades": [
        {
          "id": "routed_context_access",
          "responsabilidade": "Selecionar o menor degrau de acesso suficiente.",
          "aliases_v1": [],
          "contrato_objetivo": {
            "criterio_id": "context_and_memory.routed_context_access",
            "responsavel": "context_and_memory",
            "unidade": "turno",
            "objetivo_jogo": "Entregar o fato necessário à decisão com autoridade e contexto suficientes.",
            "gatilho_legitimo": "Existe lacuna demonstrada para a entrada ou cena.",
            "fontes_necessarias": [
              "entrada e lacuna demonstrada",
              "memória de cena/retomada entregue",
              "fatos e fontes autorizadas anteriores à interação"
            ],
            "resultado_verificavel": "A resposta resolve a lacuna com fonte e nível de acesso apropriados.",
            "negativa_valida": "L0 já contém o fato; nenhuma leitura é necessária.",
            "falha_observavel": "Lacuna ignorada, fonte inadequada ou leitura ampla sem necessidade.",
            "dimensoes": [
              "operacao",
              "oportunidade",
              "efeito_persistente",
              "experiencia"
            ],
            "guardrails": [
              "player_agency",
              "knowledge_secrecy",
              "canonical_consistency"
            ],
            "sem_evidencia": "indeterminado_fora_do_denominador"
          }
        },
        {
          "id": "scene_and_durable_memory",
          "responsabilidade": "Projetar e registrar memória com participantes e evidência corretos.",
          "aliases_v1": [],
          "contrato_objetivo": {
            "criterio_id": "context_and_memory.scene_and_durable_memory",
            "responsavel": "context_and_memory",
            "unidade": "turno",
            "objetivo_jogo": "Fazer fatos e acordos relevantes sobreviverem a mudança de cena e perda de contexto.",
            "gatilho_legitimo": "A decisão envolve fato anterior, promessa ou mudança relacional pertinente.",
            "fontes_necessarias": [
              "entrada e lacuna demonstrada",
              "memória de cena/retomada entregue",
              "fatos e fontes autorizadas anteriores à interação"
            ],
            "resultado_verificavel": "Fato correto aparece na decisão e sua mudança nova é persistida com evidência.",
            "negativa_valida": "Não há fato novo nem memória anterior pertinente.",
            "falha_observavel": "Promessa esquecida, lembrança inventada ou mudança sem persistência.",
            "dimensoes": [
              "operacao",
              "oportunidade",
              "efeito_persistente",
              "experiencia"
            ],
            "guardrails": [
              "player_agency",
              "knowledge_secrecy",
              "canonical_consistency"
            ],
            "sem_evidencia": "indeterminado_fora_do_denominador"
          }
        },
        {
          "id": "knowledge_layer_separation",
          "responsabilidade": "Impedir fusão entre conhecimento do narrador, mundo, NPC, Ren e jogador.",
          "aliases_v1": [],
          "contrato_objetivo": {
            "criterio_id": "context_and_memory.knowledge_layer_separation",
            "responsavel": "context_and_memory",
            "unidade": "turno",
            "objetivo_jogo": "Preservar descoberta legítima e conhecimentos diferentes entre atores.",
            "gatilho_legitimo": "Rumor, segredo, identidade ou informação transmitida afeta a decisão.",
            "fontes_necessarias": [
              "entrada e lacuna demonstrada",
              "memória de cena/retomada entregue",
              "fatos e fontes autorizadas anteriores à interação"
            ],
            "resultado_verificavel": "A informação só é usada pelo ator com fonte e canal legítimos.",
            "negativa_valida": "Ator ainda não percebeu ou não recebeu a informação.",
            "falha_observavel": "Segredo, rumor ou conhecimento do narrador vira certeza do ator.",
            "dimensoes": [
              "operacao",
              "oportunidade",
              "efeito_persistente",
              "experiencia"
            ],
            "guardrails": [
              "player_agency",
              "knowledge_secrecy",
              "canonical_consistency"
            ],
            "sem_evidencia": "indeterminado_fora_do_denominador"
          }
        }
      ],
      "visibilidade_jogador": "indireta",
      "rotulo_jogador": "Continuidade e lembrança do que importa",
      "indicadores_especializados": [
        {
          "id": "fracao_l0_l2_suficiente",
          "unidade": "proporcao",
          "direcao_desejada": "maior"
        },
        {
          "id": "leituras_raw_sem_justificativa",
          "unidade": "contagem",
          "direcao_desejada": "menor"
        },
        {
          "id": "fatos_duraveis_com_evidencia",
          "unidade": "proporcao",
          "direcao_desejada": "maior"
        }
      ],
      "guardrails_aplicaveis": [
        "player_agency",
        "knowledge_secrecy",
        "canonical_consistency"
      ],
      "versao_implementacao": "1.0.2",
      "versao_avaliacao": "4.0.0"
    },
    {
      "id": "turn_and_session_orchestration",
      "responsabilidade": "Executar o ciclo transacional de turno e sessão exatamente uma vez, com recuperação explícita e commits idempotentes.",
      "escopo": "Preparar, concluir, checkpoint, iniciar, encerrar e recuperar; não substitui os módulos de domínio.",
      "unidade_analise": "turno",
      "contrato_elegibilidade": {
        "gatilho": "Há avanço narrativo ON ou transição de lifecycle solicitada.",
        "exclusoes": [
          "Entrada OFF",
          "Consulta pós-hoc de engenharia"
        ],
        "evidencias_minimas": [
          "classificação ON/OFF/RECALL",
          "ticket ou recibo de lifecycle"
        ]
      },
      "resultados_possiveis": [
        "ciclo_concluido",
        "bloqueado_por_pendencia",
        "bloqueado_por_recovery",
        "recuperado",
        "ticket_obsoleto",
        "ticket_incompativel",
        "ciclo_incompleto",
        "indeterminado"
      ],
      "subcapacidades": [
        {
          "id": "transactional_turn",
          "responsabilidade": "Manter o par preparar/concluir e a atomicidade do turno.",
          "aliases_v1": [],
          "contrato_objetivo": {
            "criterio_id": "turn_and_session_orchestration.transactional_turn",
            "responsavel": "turn_and_session_orchestration",
            "unidade": "turno",
            "objetivo_jogo": "Concluir a ação narrada e seus efeitos na mesma interação verificável.",
            "gatilho_legitimo": "Entrada ON válida e ticket preparado para a intenção.",
            "fontes_necessarias": [
              "entrada ON/OFF/RECALL",
              "ticket e resultados correlacionados",
              "journal e efeitos persistentes da interação"
            ],
            "resultado_verificavel": "Preparar e concluir correlacionam resposta visível e efeitos comprometidos.",
            "negativa_valida": "OFF/RECALL não autorizam avanço; pendência bloqueia narração.",
            "falha_observavel": "Ticket errado, narração antes da barreira ou divergência entre prosa e commit.",
            "dimensoes": [
              "operacao",
              "oportunidade",
              "efeito_persistente",
              "experiencia"
            ],
            "guardrails": [
              "player_agency",
              "canonical_consistency"
            ],
            "sem_evidencia": "indeterminado_fora_do_denominador"
          }